{
  "$schema": "./crm_app_paths.schema.json",
  "schema_version": 1,
  "paths": {
    "appShellPrefix": "/app",
    "overview": "/app/overview",
    "analytics": "/app/analytics",
    "analyticsLeadConversionFunnel": "/app/analytics/lead-conversion",
    "work": "/app/work",
    "onboarding": "/app/onboarding/",
    "onboardingCompany": "/app/onboarding/company",
    "onboardingGettingStarted": "/app/onboarding/getting-started",
    "onboardingWizard": "/app/onboarding/wizard",
    "clientsDirectory": "/app/clients/directory",
    "agencyClients": "/app/clients",
    "clientsLinkBase": "/app/clients/link",
    "hr": "/app/hr",
    "hrInbox": "/app/hr/inbox",
    "hrTasks": "/app/hr/tasks",
    "hrCompliance": "/app/hr/compliance",
    "hrDocuments": "/app/hr/documents",
    "hrDocumentsMissing": "/app/hr/documents/missing",
    "hrDocumentsExpiring": "/app/hr/documents/expiring",
    "hrDocumentsVerification": "/app/hr/documents/verification",
    "hrZusWorkspace": "/app/hr/zus-workspace",
    "hrHandoffs": "/app/hr/handoffs",
    "hrEmployees": "/app/hr/employees",
    "candidates": "/app/candidates",
    "candidatesNoNextActionPage": "/app/candidates/no-next-action",
    "candidateNew": "/app/candidates/new",
    "pipeline": "/app/pipeline",
    "vacancies": "/app/vacancies",
    "vacancyNew": "/app/vacancies/new",
    "leads": "/app/leads",
    "leadsDistribution": "/app/leads/distribution",
    "leadsDistributionRules": "/app/leads/distribution/rules",
    "sales": "/app/sales",
    "salesOrders": "/app/sales/orders",
    "launchpad": "/app/launchpad",
    "clientAcquisitionChannels": "/app/client-acquisition/channels",
    "clientAcquisitionChannelsNew": "/app/client-acquisition/channels/new",
    "services": "/app/services",
    "invoices": "/app/invoices",
    "invoiceNew": "/app/invoices/new",
    "orders": "/app/orders",
    "documents": "/app/documents",
    "procesowani": "/app/procesowani",
    "tasks": "/app/work/tasks",
    "workCalendar": "/app/work/calendar",
    "automations": "/app/automations",
    "automationAreaPrefix": "/app/automation",
    "automationRules": "/app/automation-rules",
    "automationLog": "/app/automation-log",
    "acquisitionActivity": "/app/acquisition/activity",
    "marketing": "/app/marketing",
    "marketingNew": "/app/marketing/new",
    "marketingSources": "/app/marketing/sources",
    "marketingForms": "/app/marketing/forms",
    "inbox": "/app/inbox",
    "inboxMessagesScoped": "/app/inbox?channel=messages",
    "inboxEmailScoped": "/app/inbox?channel=email",
    "inboxThreadsBase": "/app/inbox/threads",
    "calendar": "/app/calendar",
    "messages": "/app/messages",
    "email": "/app/email",
    "fleet": "/app/fleet",
    "fleetVehicles": "/app/fleet/vehicles",
    "fleetTrailers": "/app/fleet/trailers",
    "fleetDrivers": "/app/fleet/drivers",
    "fleetCounterparties": "/app/fleet/counterparties",
    "fleetAssignments": "/app/fleet/assignments",
    "fleetOperatingLines": "/app/fleet/operating-lines",
    "fleetHrBridge": "/app/fleet/hr-bridge",
    "fleetRotation": "/app/fleet/rotation",
    "fleetCalendar": "/app/fleet/calendar",
    "fleetTelematics": "/app/fleet/telematics",
    "fleetTachograph": "/app/fleet/tachograph",
    "fleetViolations": "/app/fleet/violations",
    "fleetPayroll": "/app/fleet/payroll",
    "fleetReports": "/app/fleet/reports",
    "fleetReconciliation": "/app/fleet/reconciliation",
    "fleetSettings": "/app/fleet/settings",
    "setupCommunications": "/app/setup/communications",
    "slaIncidents": "/app/sla-incidents",
    "notificationAlerts": "/app/notifications/alerts",
    "communicationsCommandAudit": "/app/communications/command-audit",
    "communicationsThreadsBase": "/app/communications/threads",
    "communicationsLegacyHub": "/app/communications",
    "profile": "/app/profile",
    "organization": "/app/organization",
    "myCompany": "/app/my-company",
    "myAvailability": "/app/my-availability",
    "teamAvailability": "/app/team-availability",
    "timeOff": "/app/time-off",
    "clientNew": "/app/clients/new",
    "companiesOperatingBilling": "/app/my-company?section=billing",
    "settings": "/app/settings",
    "settingsUsers": "/app/settings/users",
    "settingsBilling": "/app/settings/billing",
    "settingsBillingPlan": "/app/settings/billing/plan",
    "settingsLegal": "/app/settings/legal",
    "settingsCompanyAccess": "/app/settings/company-access",
    "settingsFunnels": "/app/settings/funnels",
    "settingsEmail": "/app/settings/email",
    "settingsTenantLinks": "/app/settings/tenant-links",
    "settingsIntegrations": "/app/settings/integrations",
    "settingsIntegrationsMeta": "/app/settings/integrations/meta",
    "settingsIntegrationsGoogle": "/app/settings/integrations/google",
    "settingsIntegrationsMessengerFacebook": "/app/settings/integrations/messenger/messenger",
    "settingsIntegrationsMessengerInstagram": "/app/settings/integrations/messenger/instagram",
    "settingsIntegrationsMessengerTelegram": "/app/settings/integrations/messenger/telegram",
    "settingsIntegrationsMessengerViber": "/app/settings/integrations/messenger/viber",
    "settingsIntegrationsMessengerWhatsapp": "/app/settings/integrations/messenger/whatsapp",
    "settingsIntegrationsWebhook": "/app/settings/integrations/webhook",
    "settingsIntegrationsTiktok": "/app/settings/integrations/tiktok",
    "settingsAudit": "/app/settings/audit",
    "settingsCommunications": "/app/settings/communications",
    "settingsCommunicationsMessengers": "/app/settings/communications/messengers",
    "settingsCommunicationsQueue": "/app/settings/communications/queue",
    "settingsCommunicationsSla": "/app/settings/communications/sla",
    "settingsCommunicationsTemplates": "/app/settings/communications/templates",
    "settingsCommunicationsAutomation": "/app/settings/communications/automation",
    "settingsCommunicationsLeadLifecycleEmail": "/app/settings/communications/lead-lifecycle-email",
    "settingsCommunicationsCampaigns": "/app/settings/communications/campaigns",
    "settingsTeam": "/app/settings/team",
    "settingsRiskIntel": "/app/settings/risk-intel",
    "settingsHiringPipelineGates": "/app/settings/hiring-pipeline-gates",
    "settingsTransferPolicy": "/app/settings/transfer-policy",
    "settingsRuleset": "/app/settings/ruleset",
    "settingsRequirementPolicy": "/app/settings/requirement-policy",
    "settingsDocs": "/app/settings/docs",
    "settingsMergeTemplates": "/app/settings/document-merge-templates",
    "settingsTenants": "/app/settings/tenants",
    "settingsLeads": "/app/settings/leads",
    "settingsMessageTemplates": "/app/settings/message-templates",
    "settingsLeadForms": "/app/settings/lead-forms",
    "settingsTtvReport": "/app/settings/ttv-report",
    "settingsCandidateProfiles": "/app/settings/candidate-profiles",
    "settingsCustomFields": "/app/settings/custom-fields",
    "companiesLegacy": "/app/companies",
    "doProcesowaniaLegacy": "/app/do-procesowania",
    "plannerLegacy": "/app/planner",
    "remindersLegacy": "/app/reminders",
    "activitiesLegacy": "/app/activities",
    "recruitmentSearches": "/app/recruitment/searches",
    "recruitmentSearchesNew": "/app/recruitment/searches/new",
    "recruitmentInbox": "/app/recruitment/inbox",
    "setup": "/app/setup",
    "setupClient": "/app/setup/client",
    "setupVacancy": "/app/setup/vacancy",
    "setupProcess": "/app/setup/process",
    "setupIntake": "/app/setup/intake",
    "platformSetup": "/app/platform/setup",
    "marketingDiagnostics": "/app/marketing/diagnostics"
  },
  "path_comments": {
    "inboxMessagesScoped": "Inbox with messages channel selected (legacy top-level /app/messages redirects here).",
    "messages": "Legacy: top-level /app/messages — redirects into Inbox with channel=messages.",
    "communicationsLegacyHub": "Legacy aggregate URL kept for redirects/bookmarks.",
    "settingsLeads": "Legacy aliased Meta / lead-source admin (canonical: settingsIntegrationsMeta).",
    "settingsRuleset": "Legacy leftover ruleset JSON editor (not the RPM-2 overlay writer).",
    "settingsRequirementPolicy": "RPM-2 operator overlay: persist R5 tenant_delta. Not Documents Admin vs Rules Admin.",
    "sales": "Operational sales workspace for services tenants (inquiries, work session, conversion).",
    "salesOrders": "Sales Service Orders (ADR-032 commercial deal + order lines). Not Services-module /app/orders.",
    "clientAcquisitionChannels": "Client acquisition channel list and per-channel inquiry workspace.",
    "acquisitionActivity": "Stage 3E read-only Acquisition Activity Timeline (platform campaigns).",
    "marketing": "Marketing Workspace — campaign list and Flight operator surface (Acquisition capability UI).",
    "marketingNew": "Create Campaign only (goal + Primary Target + optional context). Sources connect separately via spa_marketing_connect_source.",
    "marketingSources": "Marketing Sources foundation — intake inventory, connection, Mapping Health (C-3).",
    "marketingForms": "Marketing Forms — HostFlow Form Builder remount (C-6); SoT remains ADR-007 / settings APIs.",
    "companiesLegacy": "Legacy URLs kept for redirects / bookmarks.",
    "plannerLegacy": "Legacy planner shell — redirects to /app/calendar (Phase 2.1 absorbed planner into Activity).",
    "settingsIntegrationsMessengerFacebook": "Facebook Messenger channel under Integration hub (URL segment repeats API channel key “messenger”).",
    "hrInbox": "Internal HR inbox (handoffs); uses /api/v1/hr/* only.",
    "hrTasks": "HR lane reminder tasks; uses /api/v1/hr/tasks.",
    "hrCompliance": "HR compliance document queues; uses /api/v1/hr/documents/*.",
    "hrZusWorkspace": "ZUS operational workspace; uses /api/v1/workforce/zus-workspace/*.",
    "hrHandoffs": "Handoff detail + snapshot under HR workspace shell.",